"DFE-2621","Patrick Carey","SCS2","Director","Director of School Workforce Directorate","Department for Education","Department for Education","School Workforce Directorate","0370 000 2288","N/D","DFE-2017","630748","1.00","115000","N/A","","Other","London","nan","1"
"DFE-2623","N/D","SCS1","Deputy Director","Construction Programme Management, Planning and Assurance Deputy Director","Department for Education","Department for Education","Construction Programme Management, Planning and Assurance","0370 000 2288","N/D","DFE-2568","1738902","1.00","N/A","N/A","","Other","West Midlands","nan","1"
"DFE-2624","N/D","SCS1","Deputy Director","Legislation Division Deputy Director","Department for Education","Department for Education","Legislation Division","0370 000 2288","N/D","DFE-2497","926444","1.00","N/A","N/A","","Other","South West","nan","1"
"DFE-2626","N/D","SCS1","Deputy Director","T Levels Deputy Director","Department for Education","Department for Education","T Levels","0370 000 2288","N/D","DFE-2696","1809394","1.00","N/A","N/A","","Other","London","nan","1"
"DFE-2627","N/D","SCS1","Deputy Director","Estates Data Collection and Analysis Deputy Director","Department for Education","Department for Education","Education Estates Data Collection and Analysis","0370 000 2288","N/D","DFE-2598","2716592","1.00","N/A","N/A","","Other","London","nan","1"
"DFE-2630","N/D","SCS1","Deputy Director","CS Policy Profession Unit Deputy Director","Department for Education","Department for Education","Policy Lab","0370 000 2288","N/D","DFE-2517","572177","0.80","N/A","N/A","","Other","London","nan","1"
"DFE-2631","N/D","SCS1","Deputy Director","CS Policy Profession Unit Deputy Director","Department for Education","Department for Education","Policy Lab","0370 000 2288","N/D","DFE-2517","858402","0.80","N/A","N/A","","Other","London","nan","1"
"DFE-2632","N/D","SCS1","Deputy Director","HE Analysis Deputy Director","Department for Education","Department for Education","Higher Education Analysis","0370 000 2288","N/D","DFE-2307","3400169","0.90","N/A","N/A","","Other","London","nan","1"
"DFE-2633","Becca Taber","SCS2","Director","Resilience Director","Department for Education","Department for Education","Resilience and Policy","0370 000 2288","N/D","DFE-2543","224681","1.00","100000","N/A","","Other","London","nan","1"
"DFE-2637","N/D","SCS1","Deputy Director","Supporting and Rewarding Teachers and Leaders Deputy Director","Department for Education","Department for Education","Supporting and Rewarding Teachers and Leaders","0370 000 2288","N/D","DFE-2621","2340986","0.70","N/A","N/A","","Other","London","nan","1"
"DFE-2638","N/D","SCS1","Deputy Director","CSC Adoption, Family Justice and Alternatives to Care Deputy Director","Department for Education","Department for Education","CSC Adoption, Family Justice and Alternatives to Care","0370 000 2288","N/D","DFE-2671","1536027","1.00","N/A","N/A","","Other","London","nan","1"
"DFE-2639","N/D","SCS1","Deputy Director","School Strategy and System Deputy Director","Department for Education","Department for Education","School Strategy and System","0370 000 2288","N/D","DFE-2534","637724","0.91","N/A","N/A","","Other","London","nan","1"
"DFE-2641","N/D","SCS1","Deputy Director","Funding Policy Unit Deputy Director","Department for Education","Department for Education","Funding Policy Unit","0370 000 2288","N/D","DFE-2159","1356849","1.00","N/A","N/A","","Other","London","nan","1"
"DFE-2642","N/D","SCS1","Deputy Director","Growth and Skills Levy, Strategy and Engagement Deputy Director","Department for Education","Department for Education","Growth and Skills Levy, Strategy and Engagement","0370 000 2288","N/D","DFE-2129","1672356","1.00","N/A","N/A","","Other","London","nan","1"
"DFE-2644","N/D","SCS1","Deputy Director","Early Years Workforce Division Deputy Director","Department for Education","Department for Education","Early Years Workforce Division","0370 000 2288","N/D","DFE-2655","1844648","1.00","N/A","N/A","","Other","London","nan","1"
"DFE-2645","N/D","SCS1","Deputy Director","Revenue Funding and Demography Analysis Deputy Director","Department for Education","Department for Education","Revenue Funding and Demography Analysis","0370 000 2288","N/D","DFE-2159","1431693","1.00","N/A","N/A","","Other","London","nan","1"
"DFE-2646","N/D","SCS1","Deputy Director","Construction Delivery, North West and West Midlands Deputy Director","Department for Education","Department for Education","Construction Delivery North West and West Midlands","0370 000 2288","N/D","DFE-2568","3070027","1.00","N/A","N/A","","Other","North West","nan","1"
"DFE-2647","N/D","SCS1","Deputy Director","Inclusive Mainstream Deputy Director","Department for Education","Department for Education","Inclusive Mainstream","0370 000 2288","N/D","DFE-2298","2297064","1.00","N/A","N/A","","Other","Yorkshire and The Humber","nan","1"
"DFE-2648","N/D","SCS1","Deputy Director","Education Estates Portfolio Oversight Deputy Director","Department for Education","Department for Education","Education Estates Portfolio Oversight and Directorate Support","0370 000 2288","N/D","DFE-2598","1739079","1.00","N/A","N/A","","Other","London","nan","1"
"DFE-2649","N/D","SCS1","Deputy Director","Higher Education Quality and Regulation Deputy Director","Department for Education","Department for Education","Higher Education Quality and Regulation","0370 000 2288","N/D","DFE-2307","1111759","1.00","N/A","N/A","","Other","South West","nan","1"
"DFE-2651","N/D","SCS1","Deputy Director","Schools Productivity Unit Deputy Director","Department for Education","Department for Education","Schools Productivity Unit","0370 000 2288","N/D","DFE-2536","1240648","1.00","N/A","N/A","","Other","London","nan","1"
"DFE-2652","N/D","SCS1","Deputy Director","Financial Business Partnering: Skills, OIG and Strategy Deputy Director","Department for Education","Department for Education","Financial Business Partnering: Skills, OIG and Strategy","0370 000 2288","N/D","DFE-2159","1514380","1.00","N/A","N/A","","Other","Yorkshire and The Humber","nan","1"
"DFE-2653","N/D","SCS1","Deputy Director","Careers Deputy Director","Department for Education","Department for Education","Careers Readiness Division","0370 000 2288","N/D","DFE-2306","1679012","1.00","N/A","N/A","","Other","Yorkshire and The Humber","nan","1"
"DFE-2655","Chris Armstrong-Stacey","SCS2","Director","Director of Early Years","Department for Education","Department for Education","Early Years Directorate","0370 000 2288","N/D","DFE-2101","377093","1.00","100000","N/A","","Other","London","nan","1"
"DFE-2658","N/D","SCS1","Deputy Director","Enterprise Data for Access and Sharing Deputy Director","Department for Education","Department for Education","Enterprise Data for Access and Sharing","0370 000 2288","N/D","DFE-2553","4324040","1.00","N/A","N/A","","Other","West Midlands","nan","1"
"DFE-2660","N/D","SCS1","Deputy Director","Lifelong Loan Entitlement Deputy Director","Department for Education","Department for Education","Skills Group","0370 000 2288","N/D","DFE-2307","0","0.90","N/A","N/A","","Other","Yorkshire and The Humber","nan","1"
"DFE-2661","N/D","SCS1","Deputy Director","Regions Group: South West Deputy Director","Department for Education","Department for Education","Regions Group: South West","0370 000 2288","N/D","DFE-2614","2672800","0.89","N/A","N/A","","Other","South West","nan","1"
"DFE-2662","N/D","SCS1","Deputy Director","Behaviour, Exclusions and School Food Deputy Director","Department for Education","Department for Education","Behaviour, Exclusions and School Food","0370 000 2288","N/D","DFE-2326","1985486","1.00","N/A","N/A","","Other","London","nan","1"
"DFE-2664","N/D","SCS1","Deputy Director","Digital Delivery - Schools Deputy Director","Department for Education","Department for Education","Digital Delivery - Schools","0370 000 2288","N/D","DFE-2124","1654491","1.00","N/A","N/A","","Other","Yorkshire and The Humber","nan","1"
"DFE-2665","N/D","SCS1","Deputy Director","Future Student Finance and Funding​ Deputy Director","Department for Education","Department for Education","Future Student Finance and Funding​","0370 000 2288","N/D","DFE-2307","838689","1.00","N/A","N/A","","Other","London","nan","1"
"DFE-2667","Kiera Harper","SCS2","Director","Director of Technical Qualifications and Essential Skills","Department for Education","Department for Education","Technical Qualifications and Essential Skills","0370 000 2288","N/D","DFE-2137","0","0.60","65000","N/A","","Other","London","nan","1"
"DFE-2668","N/D","SCS1","Deputy Director","FE Workforce Deputy Director","Department for Education","Department for Education","FE Workforce","0370 000 2288","N/D","DFE-2019","0","1.00","N/A","N/A","","Other","London","nan","1"
"DFE-2669","N/D","SCS1","Deputy Director","Strategy Unit Deputy Director","Department for Education","Department for Education","Strategy Unit","0370 000 2288","N/D","DFE-2497","0","0.80","N/A","N/A","","Other","London","nan","1"
"DFE-2670","N/D","SCS1","Deputy Director","Developing Teachers and Leaders Deputy Director","Department for Education","Department for Education","Developing Teachers and Leaders","0370 000 2288","N/D","DFE-2621","3163128","0.90","N/A","N/A","","Other","London","nan","1"
"DFE-2671","Helen Waite","SCS2","Director","Director of CSC","Department for Education","Department for Education","CSC Strategy and Care System","0370 000 2288","N/D","DFE-2101","540064","1.00","100000","N/A","","Other","Yorkshire and The Humber","nan","1"
"DFE-2676","N/D","SCS1","Deputy Director","HR Systems, Recruitment and Service Centre Deputy Director","Department for Education","Department for Education","HR Systems, Recruitment & Service Centre","0370 000 2288","N/D","DFE-2566","1897437","1.00","N/A","N/A","","Other","London","nan","1"
"DFE-2677","N/D","SCS1","Deputy Director","Get Into Teaching Deputy Director","Department for Education","Department for Education","Get Into Teaching","0370 000 2288","N/D","DFE-2621","1268963","1.00","N/A","N/A","","Other","North West","nan","1"
"DFE-2679","N/D","SCS1","Deputy Director","Social Justice and Disadvantage Deputy Director","Department for Education","Department for Education","Admissions, Participation and Student Experience Division","0370 000 2288","N/D","DFE-2306","0","0.90","N/A","N/A","","Other","North West","nan","1"
"DFE-2682","Gemma Marsh","SCS2","Director","Deputy CEO of Skills England","Department for Education","Skills England","Skills England - Deputy CEO","0370 000 2288","N/D","DFE-2522","917319","1.00","120000","N/A","","Other","West Midlands","nan","1"
"DFE-2684","N/D","SCS1","Deputy Director","Commercial Delivery Deputy Director","Department for Education","Department for Education","Commercial Delivery","0370 000 2288","N/D","DFE-2536","1037595","1.00","N/A","N/A","","Other","London","nan","1"
"DFE-2685","N/D","SCS1","Deputy Director","Creative, Digital, Finance and Business Deputy Director","Department for Education","Skills England","Creative, Digital, Finance and Business","0370 000 2288","N/D","DFE-2682","1486349","1.00","N/A","N/A","","Other","London","nan","1"
"DFE-2686","N/D","SCS1","Deputy Director","Clean Energy, Life Sciences Deputy Director","Department for Education","Skills England","Clean Energy, Life Sciences","0370 000 2288","N/D","DFE-2682","1617292","1.00","N/A","N/A","","Other","North West","nan","1"
"DFE-2688","N/D","SCS1","Deputy Director","Estates Private Finance Deputy Director","Department for Education","Department for Education","Operations and Infrastructure Group","0370 000 2288","N/D","DFE-2598","0","1.00","N/A","N/A","","Other","London","nan","1"
"DFE-2689","N/D","SCS1","Deputy Director","Reform and Development Deputy Director","Department for Education","Skills England","Reform and Development","0370 000 2288","N/D","DFE-2682","2077361","1.00","N/A","N/A","","Other","London","nan","1"
"DFE-2691","N/D","SCS1","Deputy Director","Corporate Governance and Performance Deputy Director","Department for Education","Skills England","Corporate Governance and Performance","0370 000 2288","N/D","DFE-2522","1742151","0.80","N/A","N/A","","Other","London","nan","1"
"DFE-2692","N/D","SCS1","Deputy Director","Digital and Analytical Services Deputy Director","Department for Education","Department for Education","Digital and Analytical Services","0370 000 2288","N/D","DFE-2124","749552","1.00","N/A","N/A","","Other","London","nan","1"
"DFE-2693","N/D","SCS1","Deputy Director","Delivery and Reform Deputy Director","Department for Education","Skills England","Advanced Manufacturing, Defence and Construction","0370 000 2288","N/D","DFE-2682","1676529","0.80","N/A","N/A","","Other","West Midlands","nan","1"
"DFE-2694","N/D","SCS1","Deputy Director","Digital Strategy Deputy Director","Department for Education","Department for Education","Digital Strategy","0370 000 2288","N/D","DFE-2385","1303561","1.00","N/A","N/A","","Other","London","nan","1"
"DFE-2695","N/D","SCS1","Deputy Director","School Strategy and System Deputy Director","Department for Education","Department for Education","School Analysis Systems and Strategy","0370 000 2288","N/D","DFE-2312","3177054","1.00","N/A","N/A","","Other","London","nan","1"
"DFE-2696","Jane Belfourd","SCS2","Director","Director of Technical Qualifications and Essential Skills","Department for Education","Department for Education","Technical Qualifications and Essential Skills","0370 000 2288","N/D","DFE-2137","347879","0.60","60000","N/A","","Other","London","nan","1"
"DFE-2697","James Cox","SCS2","Director","ALB strategic advisor","Department for Education","Department for Education","Strategy Group","0370 000 2288","N/D","DFE-2543","0","1.00","115000","N/A","","Other","London","nan","1"
"DFE-2698","N/D","SCS1","Deputy Director","Private Office Deputy Director","Department for Education","Department for Education","Private Office","0370 000 2288","N/D","DFE-2543","2222825","1.00","N/A","N/A","","Other","London","nan","1"
"DFE-2699","N/D","SCS1","Deputy Director","Childcare Funding and Market Reform Division Deputy Director","Department for Education","Department for Education","Childcare Funding and Market Reform Division","0370 000 2288","N/D","DFE-2655","725408","0.89","N/A","N/A","","Other","London","nan","1"
"DFE-2700","N/D","SCS1","Deputy Director","CSC Data and Digital Deputy Director","Department for Education","Department for Education","CSC Data and Digital","0370 000 2288","N/D","DFE-2320","0","1.00","N/A","N/A","","Other","East Midlands","nan","1"
"DFE-2701","N/D","SCS1","Deputy Director","Regions Group: North East and National SEND Improvement and Transformation Deputy Director","Department for Education","Department for Education","Regions Group: North East and National SEND Improvement and Transformation","0370 000 2288","N/D","DFE-2056","1038242","1.00","N/A","N/A","","Other","London","nan","1"
"DFE-2703","N/D","SCS1","Deputy Director","Assessment Operations and Services Deputy Director","Department for Education","Standard and Testing Agency","Schools Group","0370 000 2288","N/D","DFE-2135","0","1.00","N/A","N/A","","Other","West Midlands","nan","1"
"DFE-2704","N/D","SCS1","Deputy Director","Family Hubs and Early Years Interventions Deputy Director","Department for Education","Department for Education","Family Hubs and Early Years Interventions","0370 000 2288","N/D","DFE-2546","1688352","0.80","N/A","N/A","","Other","London","nan","1"
"DFE-2705","N/D","SCS1","Deputy Director","Lifelong Loan Entitlement Deputy Director","Department for Education","Department for Education","Lifelong Loan Entitlement","0370 000 2288","N/D","DFE-2307","1419686","1.00","N/A","N/A","","Other","London","nan","1"
"DFE-2706","N/D","SCS1","Deputy Director","Assessment Operations and Services Deputy Director","Department for Education","Standard and Testing Agency","Assessment Operations and Services","0370 000 2288","N/D","DFE-2135","0","0.60","N/A","N/A","","Other","Yorkshire and The Humber","nan","1"
"DFE-2707","N/D","SCS1","Deputy Director","CSC Portfolio and Funding Deputy Director","Department for Education","Department for Education","CSC Portfolio and Funding","0370 000 2288","N/D","DFE-2671","3103901","1.00","N/A","N/A","","Other","London","nan","1"
"DFE-2708","N/D","SCS1","Deputy Director","Early Years Sufficiency and Entitlements Deputy Director","Department for Education","Department for Education","Early Years Sufficiency and Entitlements","0370 000 2288","N/D","DFE-2655","2526857","0.70","N/A","N/A","","Other","London","nan","1"
"DFE-2710","N/D","SCS1","Deputy Director","HR Business Partners, Strategy and Talent Deputy Director","Department for Education","Department for Education","HR Business Partners, Strategy and Talent","0370 000 2288","N/D","DFE-2566","1075314","0.70","N/A","N/A","","Other","West Midlands","nan","1"
"DFE-2711","N/D","SCS1","Deputy Director","Local Accountability and Improvement Deputy Director","Department for Education","Department for Education","Local Accountability and Improvement","0370 000 2288","N/D","DFE-2298","1882454","1.00","N/A","N/A","","Other","London","nan","1"
"DFE-2713","N/D","SCS1","Deputy Director","BSIL Strategy and Portfolio Division Deputy Director","Department for Education","Department for Education","Families Group","0370 000 2288","N/D","DFE-2546","0","1.00","N/A","N/A","","Other","London","nan","1"
"DFE-2714","N/D","SCS1","Deputy Director","Analysis and Insight Deputy Director","Department for Education","Skills England","Skills Group","0370 000 2288","N/D","DFE-2522","0","1.00","N/A","N/A","","Other","London","nan","1"
"DFE-2715","N/D","SCS1","Deputy Director","CSC Regional Cooperatives and Fostering Deputy Director","Department for Education","Department for Education","CSC Regional Cooperatives and Fostering","0370 000 2288","N/D","DFE-2671","1243888","1.00","N/A","N/A","","Other","London","nan","1"
"DFE-2716","N/D","SCS1","Deputy Director","FE Workforce Deputy Director","Department for Education","Department for Education","Further Education Workforce","0370 000 2288","N/D","DFE-2019","1210387","0.86","N/A","N/A","","Other","London","nan","1"
"DFE-2717","N/D","SCS1","Deputy Director","Northern Division Deputy Director","Department for Education","Department for Education","Northern Division","0370 000 2288","N/D","DFE-2317","2049588","1.00","N/A","N/A","","Other","Unknown","nan","1"
"DFE-2718","N/D","SCS1","Deputy Director","Families Group Central Deputy Director","Department for Education","Department for Education","Families Group","0370 000 2288","N/D","DFE-2078","0","1.00","N/A","N/A","","Other","London","nan","1"
"DFE-2719","N/D","SCS1","Deputy Director","FE Provider Infrastructure​ Deputy Director","Department for Education","Department for Education","FE Provider Infrastructure","0370 000 2288","N/D","DFE-2019","130313","0.63","N/A","N/A","","Other","London","nan","1"
"DFE-2720","N/D","SCS1","Deputy Director","Construction Delivery South East and London Deputy Director","Department for Education","Department for Education","Construction Delivery South East and London","0370 000 2288","N/D","DFE-2568","2796539","1.00","N/A","N/A","","Other","West Midlands","nan","1"
"DFE-2721","N/D","SCS1","Deputy Director","Early Years Sufficiency and Entitlements Deputy Director","Department for Education","Department for Education","Early Years Sufficiency and Entitlements","0370 000 2288","N/D","DFE-2655","0","0.70","N/A","N/A","","Other","London","nan","1"
"DFE-2722","N/D","SCS1","Deputy Director","FE Provider Infrastructure​ Deputy Director","Department for Education","Department for Education","FE Provider Infrastructure","0370 000 2288","N/D","DFE-2019","0","0.62","N/A","N/A","","Other","London","nan","1"
"DFE-2723","N/D","SCS1","Deputy Director","Funding Policy Implementation Deputy Director","Department for Education","Department for Education","Operations and Infrastructure Group","0370 000 2288","N/D","DFE-2562","0","1.00","N/A","N/A","","Other","London","nan","1"
"DFE-2724","N/D","SCS1","Deputy Director","Communications Deputy Director","Department for Education","Department for Education","Communications","0370 000 2288","N/D","DFE-2098","0","1.00","N/A","N/A","","Other","London","nan","1"
"DFE-2725","N/D","SCS1","Deputy Director","DDT Incubator Deputy Director","Department for Education","Department for Education","DDT Incubator","0370 000 2288","N/D","DFE-2124","1630757","1.00","N/A","N/A","","Other","North West","nan","1"
"DFE-2726","N/D","SCS1","Deputy Director","FE Workforce Deputy Director","Department for Education","Department for Education","FE Workforce","0370 000 2288","N/D","DFE-2019","1246887","0.90","N/A","N/A","","Other","North West","nan","1"
"DFE-2727","N/D","SCS1","Deputy Director","HR Systems, Recruitment and Service Centre Deputy Director","Department for Education","Department for Education","HR Systems, Recruitment & Service Centre","0370 000 2288","N/D","DFE-2566","0","0.90","N/A","N/A","","Other","West Midlands","nan","1"
"DFE-2728","N/D","SCS1","Deputy Director","Local Accountability and Improvement Deputy Director","Department for Education","Department for Education","Local Accountability and Improvement","0370 000 2288","N/D","DFE-2298","0","1.00","N/A","N/A","","Other","London","nan","1"
