"Post Unique Reference","Name","Grade (or equivalent)","Job Title","Job/Team Function","Parent Department","Organisation","Unit","Contact Phone","Contact E-mail","Reports to Senior Post","Salary Cost of Reports (£)","FTE","Actual Pay Floor (£)","Actual Pay Ceiling (£)","","Professional/Occupational Group","Office Region","Notes","Valid?"
"DFE-2003","N/D","SCS1","Deputy Director","Construction Delivery - EESW & London Deputy Director","Department for Education","Department for Education","Construction Delivery East England, South West and London","0370 000 2288","N/D","DFE-2568","3166621","1.00","N/A","N/A","","Other","London","nan","1"
"DFE-2004","N/D","SCS1","Deputy Director","Independent Education and School Safeguarding Deputy Director","Department for Education","Department for Education","Independent Education and School Safeguarding","0370 000 2288","N/D","DFE-2078","1665922","1.00","N/A","N/A","","Other","North East","nan","1"
"DFE-2009","N/D","SCS1","Deputy Director","Funding Policy Unit Deputy Director","Department for Education","Department for Education","Operations and Infrastructure Group","0370 000 2288","N/D","DFE-2159","0","1.00","N/A","N/A","","Other","London","nan","1"
"DFE-2010","N/D","SCS1","Deputy Director","CSC Data and Digital Deputy Director","Department for Education","Department for Education","CSC Data and Digital","0370 000 2288","N/D","DFE-2320","1557313","1.00","N/A","N/A","","Other","Yorkshire and The Humber","nan","1"
"DFE-2017","Julia Kinniburgh","SCS3","Director General","Director General of Schools Group","Department for Education","Department for Education","Schools Group","0370 000 2288","N/D","DFE-2071","689248","1.00","160000","N/A","","Other","London","nan","1"
"DFE-2019","Ailsa Harris","SCS2","Director","Director of Further Education Oversight","Department for Education","Department for Education","Further Education Oversight","0370 000 2288","N/D","DFE-2137","1698973","1.00","85000","N/A","","Other","London","nan","1"
"DFE-2021","N/D","SCS1","Deputy Director","Regions Group: National Deputy Director","Department for Education","Department for Education","Regions Group: National","0370 000 2288","N/D","DFE-2577","3979448","1.00","N/A","N/A","","Other","London","nan","1"
"DFE-2022","N/D","SCS1","Deputy Director","Regions Group: East Midlands Deputy Director","Department for Education","Department for Education","Regions Group: East Midlands","0370 000 2288","N/D","DFE-2144","2181257","1.00","N/A","N/A","","Other","Yorkshire and The Humber","nan","1"
"DFE-2025","N/D","SCS1","Deputy Director","Estates, Security and People Deputy Director","Department for Education","Department for Education","Estates, Security and People","0370 000 2288","N/D","DFE-2536","2084609","1.00","N/A","N/A","","Other","East Midlands","nan","1"
"DFE-2043","Isabelle Trowler","SCS2","Director","Chief Social Worker for Children and Families","Department for Education","Department for Education","Families Group","0370 000 2288","N/D","DFE-2101","0","1.00","160000","N/A","","Other","London","nan","1"
"DFE-2056","Katherine Cowell","SCS2","Director","Regions Group: North East Director","Department for Education","Department for Education","Regions Group: North East","0370 000 2288","N/D","DFE-2302","175096","1.00","110000","N/A","","Other","North East","nan","1"
"DFE-2057","N/D","SCS1","Deputy Director","Assessment Operations and Services Deputy Director","Department for Education","Standard and Testing Agency","Assessment Operations and Services","0370 000 2288","N/D","DFE-2135","2426955","0.60","N/A","N/A","","Other","London","nan","1"
"DFE-2062","Vicky Beer","SCS2","Director","Regions Group: North West Director","Department for Education","Department for Education","Regions Group: North West","0370 000 2288","N/D","DFE-2302","85394","0.90","145000","N/A","","Other","North East","nan","1"
"DFE-2071","Susan Acland-Hood","SCS4","Permanent Secretary","Department for Education Permanent Secretary","Department for Education","Department for Education","Department for Education","0370 000 2288","N/D","XX","874723","1.00","185000","N/A","","Other","London","nan","1"
"DFE-2072","N/D","SCS1","Deputy Director","Estates Strategy and Policy Deputy Director","Department for Education","Department for Education","Education Estates Strategy and Policy Unit","0370 000 2288","N/D","DFE-2598","1341785","1.00","N/A","N/A","","Other","London","nan","1"
"DFE-2078","Kate Dixon","SCS2","Director","Director of Strategy and Safer Streets","Department for Education","Department for Education","Strategy and Safer Streets","0370 000 2288","N/D","DFE-2101","605830","1.00","110000","N/A","","Other","London","nan","1"
"DFE-2082","Kate Dethridge","SCS2","Director","Regions Group: South East Director","Department for Education","Department for Education","Regions Group: South East","0370 000 2288","N/D","DFE-2302","70486","1.00","140000","N/A","","Other","East Midlands","nan","1"
"DFE-2083","Jonathan Duff","SCS2","Director","Regions Group: East of England Director","Department for Education","Department for Education","Regions Group: East of England","0370 000 2288","N/D","DFE-2302","205153","1.00","110000","N/A","","Other","London","nan","1"
"DFE-2084","N/D","SCS1","Deputy Director","SFSO Operational Delivery - North Deputy Director","Department for Education","Department for Education","SFSO Operational Delivery - North","0370 000 2288","N/D","DFE-2198","2523135","1.00","N/A","N/A","","Other","West Midlands","nan","1"
"DFE-2085","N/D","SCS1","Deputy Director","SFSO Operational Delivery - South Deputy Director","Department for Education","Department for Education","SFSO Operational Delivery - South","0370 000 2288","N/D","DFE-2198","2443784","1.00","N/A","N/A","","Other","London","nan","1"
"DFE-2090","Susan Lovelock","SCS2","Director","Regions Group: West Midlands Director","Department for Education","Department for Education","Regions Group: West Midlands","0370 000 2288","N/D","DFE-2302","83633","1.00","110000","N/A","","Other","London","nan","1"
"DFE-2092","N/D","SCS1","Deputy Director","Regions Group: South West and RISE National Division Deputy Director","Department for Education","Department for Education","Regions Group: South West and RISE National Division","0370 000 2288","N/D","DFE-2614","832507","1.00","N/A","N/A","","Other","North West","nan","1"
"DFE-2093","N/D","SCS1","Deputy Director","Post-16 Pathways Programme Deputy Director","Department for Education","Department for Education","Post-16 Pathways Programme","0370 000 2288","N/D","DFE-2696","2342026","1.00","N/A","N/A","","Other","London","nan","1"
"DFE-2098","Robin Punt","SCS2","Director","Director of Communications","Department for Education","Department for Education","Communications","0370 000 2288","N/D","DFE-2543","536911","1.00","135000","N/A","","Other","London","nan","1"
"DFE-2100","N/D","SCS1","Deputy Director","FE Funding Deputy Director","Department for Education","Department for Education","Further Education Funding","0370 000 2288","N/D","DFE-2019","1116564","1.00","N/A","N/A","","Other","London","nan","1"
"DFE-2101","Gila Sacks","SCS3","Director General","Director General of Families Group","Department for Education","Department for Education","Families Group","0370 000 2288","N/D","DFE-2071","697291","1.00","130000","N/A","","Other","London","nan","1"
"DFE-2104","N/D","SCS1","Deputy Director","Level 2, 16-19 English & Maths Deputy Director","Department for Education","Department for Education","Level 2, 16-19 English & Maths","0370 000 2288","N/D","DFE-2696","1122543","1.00","N/A","N/A","","Other","London","nan","1"
"DFE-2117","N/D","SCS1","Deputy Director","CSC Serious Incidents and National Safeguarding Panel Deputy Director","Department for Education","Department for Education","CSC Serious Incidents and National Safeguarding Panel","0370 000 2288","N/D","DFE-2320","1818029","1.00","N/A","N/A","","Other","South West","nan","1"
"DFE-2124","Shafiqa Jody Dawood","SCS2","Director","Chief Digital Officer","Department for Education","Department for Education","Customer Experience and Digital Directorate","0370 000 2288","N/D","DFE-2536","2447523","1.00","100000","N/A","","Other","North East","nan","1"
"DFE-2127","N/D","SCS1","Deputy Director","Products, Quality and Market Deputy Director","Department for Education","Department for Education","Products, Quality and Market","0370 000 2288","N/D","DFE-2129","1366424","1.00","N/A","N/A","","Other","East Midlands","nan","1"
"DFE-2129","Kate Ridley-Pepper","SCS2","Director","Director of Work Based Skills","Department for Education","Department for Education","Work Based Skills","0370 000 2288","N/D","DFE-2137","543691","1.00","105000","N/A","","Other","London","nan","1"
"DFE-2130","N/D","SCS1","Deputy Director","Supporting and Rewarding Teachers and Leaders Deputy Director","Department for Education","Department for Education","Supporting and Rewarding Teachers and Leaders","0370 000 2288","N/D","DFE-2621","0","0.70","N/A","N/A","","Other","Yorkshire and The Humber","nan","1"
"DFE-2135","Gillian Hillier","SCS2","Director","Chief Executive of Standards and Testing Agency","Department for Education","Standard and Testing Agency","Standards, Testing and Regulation Directorate","0370 000 2288","N/D","DFE-2017","468930","1.00","110000","N/A","","Other","Yorkshire and The Humber","nan","1"
"DFE-2137","Sinead O'Sullivan","SCS3","Director General","Director General of Skills Group","Department for Education","Department for Education","Skills Group","0370 000 2288","N/D","DFE-2071","939769","1.00","110000","N/A","","Other","London","nan","1"
"DFE-2144","Nigel Minns","SCS2","Director","Regions Group: East Midlands Director","Department for Education","Department for Education","Regions Group: East Midlands Director","0370 000 2288","N/D","DFE-2302","85394","1.00","150000","N/A","","Other","East Midlands","nan","1"
"DFE-2145","N/D","SCS1","Deputy Director","News and Social Media Deputy Director","Department for Education","Department for Education","News and Social Media","0370 000 2288","N/D","DFE-2098","1682668","1.00","N/A","N/A","","Other","London","nan","1"
"DFE-2151","N/D","SCS1","Deputy Director","Financial Business Partnering: Schools, Families, Regions and Hub Deputy Director","Department for Education","Department for Education","Financial Business Partnering: Schools, Families, Regions and Hub","0370 000 2288","N/D","DFE-2159","1128438","1.00","N/A","N/A","","Other","North East","nan","1"
"DFE-2152","N/D","SCS1","Deputy Director","Family Analysis Deputy Director","Department for Education","Department for Education","Families Analysis","0370 000 2288","N/D","DFE-2078","4307234","1.00","N/A","N/A","","Other","London","nan","1"
"DFE-2159","Anne Spinali","SCS2","Director","Director of Strategic Finance","Department for Education","Department for Education","Strategic Finance","0370 000 2288","N/D","DFE-2536","714633","1.00","115000","N/A","","Other","London","nan","1"
"DFE-2162","N/D","SCS1","Deputy Director","Capability, Investments, Analysis and Reporting Deputy Director","Department for Education","Department for Education","Capability, Investments, Analysis and Reporting","0370 000 2288","N/D","DFE-2565","1684610","1.00","N/A","N/A","","Other","North East","nan","1"
"DFE-2163","N/D","SCS1","Deputy Director","Strategic Communications and Campaigns Deputy Director","Department for Education","Department for Education","Strategic Communications and Campaigns","0370 000 2288","N/D","DFE-2098","3028288","1.00","N/A","N/A","","Other","London","nan","1"
"DFE-2173","N/D","SCS1","Deputy Director","Specialist Restructuring Deputy Director","Department for Education","Department for Education","Specialist Restructuring","0370 000 2288","N/D","DFE-2562","2102558","1.00","N/A","N/A","","Other","London","nan","1"
"DFE-2183","N/D","SCS1","Deputy Director","Teaching Workforce Teaching Analysis Deputy Director","Department for Education","Department for Education","Teaching Workforce Teaching Analysis","0370 000 2288","N/D","DFE-2621","2828844","1.00","N/A","N/A","","Other","Yorkshire and The Humber","nan","1"
"DFE-2185","N/D","SCS1","Deputy Director","Sector Reporting Deputy Director","Department for Education","Department for Education","Sector Reporting","0370 000 2288","N/D","DFE-2565","1595532","1.00","N/A","N/A","","Other","Yorkshire and The Humber","nan","1"
"DFE-2192","N/D","SCS1","Deputy Director","Assurance Deputy Director","Department for Education","Department for Education","Assurance","0370 000 2288","N/D","DFE-2562","2409366","1.00","N/A","N/A","","Other","London","nan","1"
"DFE-2197","N/D","SCS1","Deputy Director","Regions Deputy Director","Department for Education","Skills England","Regions","0370 000 2288","N/D","DFE-2682","1583633","1.00","N/A","N/A","","Other","East Midlands","nan","1"
"DFE-2198","Lindsey Henning","SCS2","Director","Schools Financial Support & Oversight Director","Department for Education","Department for Education","Regions Group: Schools Financial Support & Oversight","0370 000 2288","N/D","DFE-2302","265869","1.00","110000","N/A","","Other","Yorkshire and The Humber","nan","1"
"DFE-2200","N/D","SCS1","Deputy Director","Financial Operations Deputy Director","Department for Education","Department for Education","Financial Operations","0370 000 2288","N/D","DFE-2565","2819729","1.00","N/A","N/A","","Other","West Midlands","nan","1"
"DFE-2202","N/D","SCS1","Deputy Director","SFSO Central Division Deputy Director","Department for Education","Department for Education","SFSO Central Division","0370 000 2288","N/D","DFE-2198","2583591","1.00","N/A","N/A","","Other","London","nan","1"
"DFE-2207","N/D","SCS1","Deputy Director","Estates Legal, Land and Planning Deputy Director","Department for Education","Department for Education","Education Estates Legal, Land and Planning","0370 000 2288","N/D","DFE-2598","4470053","1.00","N/A","N/A","","Other","Unknown","nan","1"
"DFE-2208","N/D","SCS1","Deputy Director","Estates Design, Engineering, Cost and Building Technology Deputy Director","Department for Education","Department for Education","Education Estates Estates Sustainability, Standards and Innovation Unit","0370 000 2288","N/D","DFE-2598","7596593","1.00","N/A","N/A","","Other","Unknown","nan","1"
"DFE-2211","N/D","SCS1","Deputy Director","Estates Private Finance Deputy Director","Department for Education","Department for Education","Education Estates Private Finance","0370 000 2288","N/D","DFE-2598","1308400","1.00","N/A","N/A","","Other","Unknown","nan","1"
"DFE-2212","N/D","SCS1","Deputy Director","Regulation and Quality Deputy Director","Department for Education","Department for Education","Schools Regulation and Quality","0370 000 2288","N/D","DFE-2312","1065773","0.60","N/A","N/A","","Other","North West","nan","1"
"DFE-2215","N/D","SCS1","Deputy Director","Teaching Regulation Agency Deputy Director","Department for Education","Teaching Regulation Agency","Teaching Regulation Agency","0370 000 2288","N/D","DFE-2135","2782626","1.00","N/A","N/A","","Other","London","nan","1"
"DFE-2218","N/D","SCS1","Deputy Director","FE Workforce Deputy Director","Department for Education","Department for Education","Further Education Workforce","0370 000 2288","N/D","DFE-2019","0","0.60","N/A","N/A","","Other","London","nan","1"
"DFE-2221","Carolan Goggin","SCS2","Director","Regions Group: National Director","Department for Education","Department for Education","Regions Group: National","0370 000 2288","N/D","DFE-2302","0","0.90","95000","N/A","","Other","North West","nan","1"
"DFE-2222","N/D","SCS1","Deputy Director","Construction Delivery South East and London Deputy Director","Department for Education","Department for Education","Construction Delivery South East and London","0370 000 2288","N/D","DFE-2568","139355","1.00","N/A","N/A","","Other","London","nan","1"
"DFE-2223","N/D","SCS1","Deputy Director","Improvement and Insight Deputy Director","Department for Education","Department for Education","Improvement and Insight","0370 000 2288","N/D","DFE-2565","1478106","1.00","N/A","N/A","","Other","London","nan","1"
"DFE-2224","N/D","SCS1","Deputy Director","School System Accountability Deputy Director","Department for Education","Department for Education","Schools System Accountability","0370 000 2288","N/D","DFE-2312","1607905","1.00","N/A","N/A","","Other","London","nan","1"
"DFE-2228","N/D","SCS1","Deputy Director","Central Capital Unit Deputy Director","Department for Education","Department for Education","Central Capital Unit","0370 000 2288","N/D","DFE-2159","1313356","1.00","N/A","N/A","","Other","London","nan","1"
"DFE-2231","N/D","SCS1","Deputy Director","Access, Participation and Applications​ Deputy Director","Department for Education","Department for Education","SEND and NEETs Division","0370 000 2288","N/D","DFE-2306","1069913","1.00","N/A","N/A","","Other","South West","nan","1"
"DFE-2232","N/D","SCS1","Deputy Director","Young Futures, Educational Engagement and Serious Violence Deputy Director","Department for Education","Department for Education","Familiies Group","0370 000 2288","N/D","DFE-2546","0","0.60","N/A","N/A","","Other","London","nan","1"
"DFE-2238","N/D","SCS1","Deputy Director","Central Analysis Unit Deputy Director","Department for Education","Department for Education","Central Analysis Unit","0370 000 2288","N/D","DFE-2534","2439705","1.00","N/A","N/A","","Other","North East","nan","1"
"DFE-2239","N/D","SCS1","Deputy Director","Higher Education Strategy and Portfolio Deputy Director","Department for Education","Department for Education","Higher Education Strategy and Portfolio","0370 000 2288","N/D","DFE-2307","1754087","1.00","N/A","N/A","","Other","London","nan","1"
"DFE-2240","N/D","SCS1","Deputy Director","Early Years Improvement Division Deputy Director","Department for Education","Department for Education","Early Years Improvement Division","0370 000 2288","N/D","DFE-2655","2359574","1.00","N/A","N/A","","Other","London","nan","1"
"DFE-2249","N/D","SCS1","Deputy Director","Ministerial and Public Communications Division Deputy Director","Department for Education","Department for Education","Ministerial and Public Communications Division","0370 000 2288","N/D","DFE-2098","3580735","1.00","N/A","N/A","","Other","Yorkshire and The Humber","nan","1"
"DFE-2257","N/D","SCS1","Deputy Director","Private Office Deputy Director","Department for Education","Department for Education","Strategy Group","0370 000 2288","N/D","DFE-2543","0","1.00","N/A","N/A","","Other","London","nan","1"
"DFE-2275","Alan Parnum","SCS2","Director","Regions Group: London Director","Department for Education","Department for Education","Regions Group: London","0370 000 2288","N/D","DFE-2302","2785345","1.00","100000","N/A","","Other","London","nan","1"
"DFE-2277","N/D","SCS1","Deputy Director","Strategy and Portfolio Deputy Director","Department for Education","Department for Education","Strategy and Portfolio","0370 000 2288","N/D","DFE-2621","1376909","1.00","N/A","N/A","","Other","London","nan","1"
"DFE-2279","N/D","SCS1","Deputy Director","Regions Group: National Deputy Director","Department for Education","Department for Education","Regions Group: National","0370 000 2288","N/D","DFE-2577","3161998","1.00","N/A","N/A","","Other","London","nan","1"
"DFE-2281","N/D","SCS1","Deputy Director","Infrastructure & Platforms Deputy Director","Department for Education","Department for Education","Infrastructure & Platforms","0370 000 2288","N/D","DFE-2124","5037749","1.00","N/A","N/A","","Other","North East","nan","1"
"DFE-2290","N/D","SCS1","Deputy Director","Counter Fraud and Prevention Deputy Director","Department for Education","Department for Education","Counter Fraud  and Prevention","0370 000 2288","N/D","DFE-2562","2533538","1.00","N/A","N/A","","Other","West Midlands","nan","1"
"DFE-2292","N/D","SCS1","Deputy Director","Operational Excellence Deputy Director","Department for Education","Department for Education","Funding Operations","0370 000 2288","N/D","DFE-2562","5071816","1.00","N/A","N/A","","Other","North West","nan","1"
"DFE-2298","Claire Burton","SCS2","Director","Director of Inclusive Mainstream","Department for Education","Department for Education","SEND and Alternative Provision","0370 000 2288","N/D","DFE-2017","539716","1.00","115000","N/A","","Other","London","nan","1"
"DFE-2299","N/D","SCS1","Deputy Director","Job Share - CSC Looked After Children Placements Deputy Director","Department for Education","Department for Education","CSC Looked After Children Placements","0370 000 2288","N/D","DFE-2671","1391968","1.00","N/A","N/A","","Other","London","Job Share","1"
"DFE-2299","N/D","SCS1","Deputy Director","Job Share - CSC Looked After Children Placements Deputy Director","Department for Education","Department for Education","CSC Looked After Children Placements","0370 000 2288","N/D","DFE-2671","1391968","1.00","N/A","N/A","","Other","London","Job Share","1"
"DFE-2302","Timothy Coulson","SCS3","Director General","Director General of Regions Group","Department for Education","Department for Education","Regions Group","0370 000 2288","N/D","DFE-2071","1376760","1.00","160000","N/A","","Other","London","nan","1"
"DFE-2306","Hannah Sheehan","SCS2","Director","Director of Skills Journey","Department for Education","Department for Education","International and Student Experience Directorate","0370 000 2288","N/D","DFE-2137","540228","1.00","110000","N/A","","Other","London","nan","1"
"DFE-2307","Patrick Curry","SCS2","Director","Director of Higher Education Oversight","Department for Education","Department for Education","Higher Education Oversight","0370 000 2288","N/D","DFE-2137","675547","1.00","110000","N/A","","Other","Yorkshire and The Humber","nan","1"
"DFE-2311","N/D","SCS1","Deputy Director","Sustainability and Strategic Projects Deputy Director","Department for Education","Department for Education","Sustainability and Strategic Projects","0370 000 2288","N/D","DFE-2517","987175","1.00","N/A","N/A","","Other","London","nan","1"
"DFE-2312","Alex Marsh","SCS2","Director","Director of School Analysis Systems and Strategy","Department for Education","Department for Education","School Analysis Systems and Strategy","0370 000 2288","N/D","DFE-2017","403771","1.00","115000","N/A","","Other","London","nan","1"
"DFE-2317","Roger Cotes","SCS2","Director","Director of Regional Performance","Department for Education","Department for Education","HE FE Improvement and Intervention Division","0370 000 2288","N/D","DFE-2137","1524026","1.00","105000","N/A","","Other","Yorkshire and The Humber","nan","1"
"DFE-2320","Shazia Hussain","SCS2","Director","Director of Safeguarding and Workforce","Department for Education","Department for Education","CSC Safeguarding and Workforce","0370 000 2288","N/D","DFE-2101","525681","1.00","110000","N/A","","Other","London","nan","1"
"DFE-2324","N/D","SCS1","Deputy Director","High Quality Curriculum Deputy Director","Department for Education","Department for Education","Schools Group","0370 000 2288","N/D","DFE-2385","0","1.00","N/A","N/A","","Other","London","nan","1"
"DFE-2326","Sophie Taylor","SCS2","Director","Director of Educational Engagement, Access and Wellbeing","Department for Education","Department for Education","Educational Engagement, Access and Wellbeing (EEAW)","0370 000 2288","N/D","DFE-2017","2004818","1.00","110000","N/A","","Other","London","nan","1"
"DFE-2327","N/D","SCS1","Deputy Director","Digital Strategy Deputy Director","Department for Education","Department for Education","Digital Delivery - Regions","0370 000 2288","N/D","DFE-2124","747080","1.00","N/A","N/A","","Other","London","nan","1"
"DFE-2332","N/D","SCS1","Deputy Director","Northern Division Deputy Director","Department for Education","Department for Education","Skills Group","0370 000 2288","N/D","DFE-2317","0","1.00","N/A","N/A","","Other","Unknown","nan","1"
"DFE-2334","N/D","SCS1","Deputy Director","Customer Success & Shared Service Operations Deputy Director","Department for Education","Department for Education","Customer Success & Shared Service Operations","0370 000 2288","N/D","DFE-2124","2470626","1.00","N/A","N/A","","Other","West Midlands","nan","1"
"DFE-2337","N/D","SCS1","Deputy Director","CSC Child Protection and Safeguarding Deputy Director","Department for Education","Department for Education","CSC Child Protection and Safeguarding","0370 000 2288","N/D","DFE-2320","2048795","1.00","N/A","N/A","","Other","London","nan","1"
"DFE-2341","N/D","SCS1","Deputy Director","Strategy and Qualifications Deputy Director","Department for Education","Department for Education","Strategy and Qualifications","0370 000 2288","N/D","DFE-2385","1259733","0.90","N/A","N/A","","Other","London","nan","1"
"DFE-2344","N/D","SCS1","Deputy Director","Construction Grants, Assurance and Response Deputy Director","Department for Education","Department for Education","Construction Grants, Assurance and Response","0370 000 2288","N/D","DFE-2598","2510059","1.00","N/A","N/A","","Other","North West","nan","1"
"DFE-2346","N/D","SCS1","Deputy Director","Admissions, School Organisation, Transport Deputy Director","Department for Education","Department for Education","Admissions, School Organisation, Transport","0370 000 2288","N/D","DFE-2326","1324081","1.00","N/A","N/A","","Other","London","nan","1"
"DFE-2347","N/D","SCS1","Deputy Director","CSC Outcomes, Care Leavers and Capital Deputy Director","Department for Education","Department for Education","CSC Outcomes, Care Leavers and Capital","0370 000 2288","N/D","DFE-2671","1538269","1.00","N/A","N/A","","Other","London","nan","1"
"DFE-2349","N/D","SCS1","Deputy Director","Stakeholder Engagement Deputy Director","Department for Education","Department for Education","Stakeholder Engagement","0370 000 2288","N/D","DFE-2497","934969","1.00","N/A","N/A","","Other","London","nan","1"
