"DFE-2353","N/D","SCS1","Deputy Director","Specialist Sector Reform Deputy Director","Department for Education","Department for Education","Specialist Sector Reform","0370 000 2288","N/D","DFE-2298","1167298","1.00","N/A","N/A","","Other","London","nan","1"
"DFE-2355","N/D","SCS1","Deputy Director","Commercial Operations Deputy Director","Department for Education","Department for Education","Commercial Operations","0370 000 2288","N/D","DFE-2536","2195068","1.00","N/A","N/A","","Other","North East","nan","1"
"DFE-2367","Gemma Peck","SCS2","Director","Director of Skills Strategy & Engagement","Department for Education","Department for Education","Skills Strategy and Engagement","0370 000 2288","N/D","DFE-2137","2780229","1.00","110000","N/A","","Other","London","nan","1"
"DFE-2368","N/D","SCS1","Deputy Director","Internal Comms and GCS Change Deputy Director","Department for Education","Department for Education","Internal Comms and GCS Change","0370 000 2288","N/D","DFE-2098","309598","1.00","N/A","N/A","","Other","London","nan","1"
"DFE-2369","N/D","SCS1","Deputy Director","Job Share - DfE Inquiry Response Deputy Director","Department for Education","Department for Education","DfE Inquiry Response","0370 000 2288","N/D","DFE-2633","898636","1.00","N/A","N/A","","Other","London","Job Share","1"
"DFE-2369","N/D","SCS1","Deputy Director","Job Share - DfE Inquiry Response Deputy Director","Department for Education","Department for Education","DfE Inquiry Response","0370 000 2288","N/D","DFE-2633","898636","1.00","N/A","N/A","","Other","London","Job Share","1"
"DFE-2382","N/D","SCS1","Deputy Director","Rapid Response Co-ordination Deputy Director","Department for Education","Department for Education","Rapid Response Co-ordination","0370 000 2288","N/D","DFE-2633","1598886","1.00","N/A","N/A","","Other","London","nan","1"
"DFE-2385","Jenny Oldroyd","SCS2","Director","Director of Curriculum and General Qualifications","Department for Education","Department for Education","Curriculum and General Qualifications","0370 000 2288","N/D","DFE-2017","1641114","1.00","110000","N/A","","Other","London","nan","1"
"DFE-2392","N/D","SCS1","Deputy Director","Enterprise Data for Insight Deputy Director","Department for Education","Department for Education","Enterprise Data for Insight","0370 000 2288","N/D","DFE-2553","4601236","1.00","N/A","N/A","","Other","West Midlands","nan","1"
"DFE-2393","N/D","SCS1","Deputy Director","Best Start Family Service Design Division Deputy Director","Department for Education","Department for Education","Best Start Family Service Design Division","0370 000 2288","N/D","DFE-2546","1725696","1.00","N/A","N/A","","Other","London","nan","1"
"DFE-2398","N/D","SCS1","Deputy Director","Counter Extremism and Non-School Education Deputy Director","Department for Education","Department for Education","Counter Extremism and Non-School Education","0370 000 2288","N/D","DFE-2078","2302621","0.90","N/A","N/A","","Other","London","nan","1"
"DFE-2400","N/D","SCS1","Deputy Director","Insight and Statistics Deputy Director","Department for Education","Department for Education","Insight and Statistics","0370 000 2288","N/D","DFE-2534","3687321","1.00","N/A","N/A","","Other","London","nan","1"
"DFE-2401","N/D","SCS1","Deputy Director","Family Support Deputy Director","Department for Education","Department for Education","Family Support","0370 000 2288","N/D","DFE-2320","2547423","1.00","N/A","N/A","","Other","Yorkshire and The Humber","nan","1"
"DFE-2403","N/D","SCS1","Deputy Director","Regions Group: East of England and Schools Strategic Delivery Division Deputy Director","Department for Education","Department for Education","Regions Group: East of England and Schools Strategic","0370 000 2288","N/D","DFE-2083","490701","1.00","N/A","N/A","","Other","South West","nan","1"
"DFE-2406","N/D","SCS1","Deputy Director","Regions Group: West Midlands Deputy Director","Department for Education","Department for Education","Regions Group: West Midlands","0370 000 2288","N/D","DFE-2090","2577816","1.00","N/A","N/A","","Other","West Midlands","nan","1"
"DFE-2407","N/D","SCS1","Deputy Director","HR Organisation Design, Development & Engagement Deputy Director","Department for Education","Department for Education","HR Organisation Design, Development & Engagement","0370 000 2288","N/D","DFE-2566","1572358","1.00","N/A","N/A","","Other","Yorkshire and The Humber","nan","1"
"DFE-2409","N/D","SCS1","Deputy Director","Regions Group: North East Deputy Director","Department for Education","Department for Education","Regions Group: North East","0370 000 2288","N/D","DFE-2056","1417129","1.00","N/A","N/A","","Other","North East","nan","1"
"DFE-2418","N/D","SCS1","Deputy Director","English, Maths, Music & Arts Deputy Director","Department for Education","Department for Education","English, Maths, Music & Arts","0370 000 2288","N/D","DFE-2385","2614941","1.00","N/A","N/A","","Other","London","nan","1"
"DFE-2423","N/D","SCS1","Deputy Director","Work Based Skills Operations and Performance Deputy Director","Department for Education","Department for Education","Work Based Skills Operations and Performance","0370 000 2288","N/D","DFE-2129","1421917","1.00","N/A","N/A","","Other","West Midlands","nan","1"
"DFE-2432","N/D","SCS1","Deputy Director","International Strategy & Partnerships Deputy Director","Department for Education","Department for Education","International Strategy & Partnerships","0370 000 2288","N/D","DFE-2517","1629764","1.00","N/A","N/A","","Other","London","nan","1"
"DFE-2434","N/D","SCS1","Deputy Director","Analysis and Insight Deputy Director","Department for Education","Skills England","Analysis and Insights","0370 000 2288","N/D","DFE-2522","1284663","1.00","N/A","N/A","","Other","London","nan","1"
"DFE-2439","N/D","SCS1","Deputy Director","Regions Group: South East Deputy Director","Department for Education","Department for Education","Regions Group: South East","0370 000 2288","N/D","DFE-2082","2721656","0.80","N/A","N/A","","Other","London","nan","1"
"DFE-2443","N/D","SCS1","Deputy Director","CSC Regional Cooperatives and Fostering Deputy Director","Department for Education","Department for Education","CSC Regional Cooperatives and Fostering","0370 000 2288","N/D","DFE-2671","682977","1.00","N/A","N/A","","Other","London","nan","1"
"DFE-2446","N/D","SCS1","Deputy Director","Regions Group: Yorkshire & Humber and National CSC and BSiL Deputy Director","Department for Education","Department for Education","Regions Group: Yorkshire & Humber and National CSC and BSiL","0370 000 2288","N/D","DFE-2555","0","0.60","N/A","N/A","","Other","London","nan","1"
"DFE-2454","N/D","SCS1","Deputy Director","Financial Reporting Deputy Director","Department for Education","Department for Education","Financial Reporting","0370 000 2288","N/D","DFE-2565","2593727","1.00","N/A","N/A","","Other","North West","nan","1"
"DFE-2456","N/D","SCS1","Deputy Director","Life Skills Deputy Director","Department for Education","Department for Education","Life Skills","0370 000 2288","N/D","DFE-2326","1754357","1.00","N/A","N/A","","Other","Yorkshire and The Humber","nan","1"
"DFE-2457","N/D","SCS1","Deputy Director","HR Business Partners, Strategy and Talent Deputy Director","Department for Education","Department for Education","HR Business Partners, Strategy and Talent","0370 000 2288","N/D","DFE-2566","0","0.70","N/A","N/A","","Other","Yorkshire and The Humber","nan","1"
"DFE-2461","N/D","SCS1","Deputy Director","Technology Operations Deputy Director","Department for Education","Department for Education","Technology Operations","0370 000 2288","N/D","DFE-2124","6052546","1.00","N/A","N/A","","Other","North West","nan","1"
"DFE-2470","N/D","SCS1","Deputy Director","International Evidence and Trade Deputy Director","Department for Education","Department for Education","International Surveys, Trade and Security","0370 000 2288","N/D","DFE-2517","876859","1.00","N/A","N/A","","Other","Yorkshire and The Humber","nan","1"
"DFE-2475","N/D","SCS1","Deputy Director","DDT Incubator Deputy Director","Department for Education","Department for Education","DDT Incubator","0370 000 2288","N/D","DFE-2124","0","1.00","N/A","N/A","","Other","London","nan","1"
"DFE-2478","N/D","SCS1","Deputy Director","Customer Experience & Design Deputy Director","Department for Education","Department for Education","Customer Experience & Design","0370 000 2288","N/D","DFE-2124","2280760","1.00","N/A","N/A","","Other","North West","nan","1"
"DFE-2485","N/D","SCS1","Deputy Director","Cyber and Information Security Deputy Director","Department for Education","Department for Education","Cyber and Information Security (CISO)","0370 000 2288","N/D","DFE-2124","1992586","1.00","N/A","N/A","","Other","London","nan","1"
"DFE-2486","N/D","SCS1","Deputy Director","The Apprenticeships Service​ Deputy Director","Department for Education","Department for Education","The Apprenticeships Service (DDAT)​","0370 000 2288","N/D","DFE-2124","4962885","1.00","N/A","N/A","","Other","West Midlands","nan","1"
"DFE-2489","N/D","SCS1","Deputy Director","Data, Performance and Corporate Operations Division Deputy Director","Department for Education","Department for Education","Data, Performance and Corporate Operations Division","0370 000 2288","N/D","DFE-2317","1079574","1.00","N/A","N/A","","Other","Unknown","nan","1"
"DFE-2497","Warwick Sharp","SCS2","Director","Strategy and Delivery Directorate Director","Department for Education","Department for Education","Delivery Unit","0370 000 2288","N/D","DFE-2543","563779","1.00","110000","N/A","","Other","London","nan","1"
"DFE-2498","N/D","SCS1","Deputy Director","CS Policy Profession Unit Deputy Director","Department for Education","Department for Education","CS Policy Profession Unit","0370 000 2288","N/D","DFE-2517","444245","1.00","N/A","N/A","","Other","London","nan","1"
"DFE-2501","N/D","SCS1","Deputy Director","Delivery Unit Deputy Director","Department for Education","Department for Education","Delivery Unit","0370 000 2288","N/D","DFE-2497","1133904","1.00","N/A","N/A","","Other","London","nan","1"
"DFE-2503","N/D","SCS1","Deputy Director","Digital Delivery - Vulnerable Families & Children Deputy Director","Department for Education","Department for Education","Digital Delivery - Vulnerable Families & Children","0370 000 2288","N/D","DFE-2124","2121080","1.00","N/A","N/A","","Other","Yorkshire and The Humber","nan","1"
"DFE-2504","N/D","SCS1","Deputy Director","Schools Digital Deputy Director","Department for Education","Department for Education","Schools Digital","0370 000 2288","N/D","DFE-2312","6809383","1.00","N/A","N/A","","Other","London","nan","1"
"DFE-2507","N/D","SCS1","Deputy Director","Midlands and South West Division Deputy Director","Department for Education","Department for Education","Midlands and South West Division","0370 000 2288","N/D","DFE-2317","2328998","1.00","N/A","N/A","","Other","Unknown","nan","1"
"DFE-2508","N/D","SCS1","Deputy Director","London, South East and East of England Division Deputy Director","Department for Education","Department for Education","London, South East and East of England Division","0370 000 2288","N/D","DFE-2317","2193561","1.00","N/A","N/A","","Other","Unknown","nan","1"
"DFE-2514","N/D","SCS1","Deputy Director","Regions Group: North West Deputy Director","Department for Education","Department for Education","Regions Group: North West","0370 000 2288","N/D","DFE-2062","2897761","1.00","N/A","N/A","","Other","North West","nan","1"
"DFE-2516","N/D","SCS1","Deputy Director","Student Funding Policy​ Deputy Director","Department for Education","Department for Education","Student Funding Policy​","0370 000 2288","N/D","DFE-2307","1086627","1.00","N/A","N/A","","Other","London","nan","1"
"DFE-2517","Donna Ward","SCS2","Director","Director of Strategic Policy","Department for Education","Department for Education","Strategic Policy Directorate (SPD)","0370 000 2288","N/D","DFE-2543","3097236","1.00","130000","N/A","","Other","London","nan","1"
"DFE-2519","N/D","SCS1","Deputy Director","Widening Participation and Student Experience Deputy Director","Department for Education","Department for Education","Admissions, Participation and Student Experience Division","0370 000 2288","N/D","DFE-2306","1305853","0.50","N/A","N/A","","Other","Yorkshire and The Humber","nan","1"
"DFE-2520","N/D","SCS1","Deputy Director","Skills Policy Analysis​ Deputy Director","Department for Education","Department for Education","Skills Policy Analysis​","0370 000 2288","N/D","DFE-2019","2358402","1.00","N/A","N/A","","Other","London","nan","1"
"DFE-2522","Sarah Maclean","SCS2","Director","Job Share - Skills England CEO","Department for Education","Skills England","Skills England CEO","0370 000 2288","N/D","DFE-2137","376236","1.00","85000","N/A","","Other","London","Job Share","1"
"DFE-2522","Tessa Griffiths","SCS2","Director","Job Share - Skills England CEO","Department for Education","Skills England","Skills England CEO","0370 000 2288","N/D","DFE-2137","376236","1.00","85000","N/A","","Other","London","Job Share","1"
"DFE-2527","N/D","SCS1","Deputy Director","HR Policy, Pay, Specialist Advice and Employee Relations Deputy Director","Department for Education","Department for Education","HR Policy, Pay, Specialist Advice and Employee Relations","0370 000 2288","N/D","DFE-2566","1460101","1.00","N/A","N/A","","Other","Yorkshire and The Humber","nan","1"
"DFE-2533","N/D","SCS1","Deputy Director","Attendance Deputy Director","Department for Education","Department for Education","Attendance","0370 000 2288","N/D","DFE-2326","1449049","1.00","N/A","N/A","","Other","London","nan","1"
"DFE-2534","Ian Knowles","SCS2","Director","Strategic Analysis, Research, Data, Intelligence & Science Director","Department for Education","Department for Education","Strategic Analysis, Research, Data, Intelligence & Science (SARDIS)","0370 000 2288","N/D","DFE-2543","433617","1.00","115000","N/A","","Other","London","nan","1"
"DFE-2535","N/D","SCS1","Deputy Director","Assessment Research and Development Deputy Director","Department for Education","Standard and Testing Agency","Assessment Research and Development","0370 000 2288","N/D","DFE-2135","2619311","1.00","N/A","N/A","","Other","London","nan","1"
"DFE-2536","Jane Cunliffe","SCS3","Director General","Director General of Operations and Infrastructure Group","Department for Education","Department for Education","Operations and Infrastructure Group","0370 000 2288","N/D","DFE-2071","5878961","1.00","155000","N/A","","Other","London","nan","1"
"DFE-2541","N/D","SCS1","Deputy Director","Teacher Training and Recruitment Deputy Director","Department for Education","Department for Education","Teacher Training and Recruitment","0370 000 2288","N/D","DFE-2621","2796661","1.00","N/A","N/A","","Other","London","nan","1"
"DFE-2542","N/D","SCS1","Deputy Director","V Levels & Cross-Cutting Engagement Deputy Director","Department for Education","Department for Education","V Levels & Cross-Cutting Engagement","0370 000 2288","N/D","DFE-2696","937963","1.00","N/A","N/A","","Other","London","nan","1"
"DFE-2543","Tony Foot","SCS3","Director General","Director General of Strategy Group","Department for Education","Department for Education","Strategy Group","0370 000 2288","N/D","DFE-2071","1180621","1.00","150000","N/A","","Other","London","nan","1"
"DFE-2544","N/D","SCS1","Deputy Director","Job Share - Breakfast Clubs, Wraparound Childcare and HAF Deputy Director","Department for Education","Department for Education","Breakfast Clubs, Wraparound Childcare and HAF","0370 000 2288","N/D","DFE-2326","3280852","1.00","N/A","N/A","","Other","London","Job Share","1"
"DFE-2544","N/D","SCS1","Deputy Director","Job Share - Breakfast Clubs, Wraparound Childcare and HAF Deputy Director","Department for Education","Department for Education","Breakfast Clubs, Wraparound Childcare and HAF","0370 000 2288","N/D","DFE-2326","3280852","1.00","N/A","N/A","","Other","London","Job Share","1"
"DFE-2546","Susie Owen","SCS2","Director","Director of Early Years","Department for Education","Department for Education","Early Years Directorate","0370 000 2288","N/D","DFE-2101","1721574","1.00","110000","N/A","","Other","London","nan","1"
"DFE-2551","N/D","SCS1","Deputy Director","Families Group Central Deputy Director","Department for Education","Department for Education","Families Group Central","0370 000 2288","N/D","DFE-2078","1634653","1.00","N/A","N/A","","Other","Yorkshire and The Humber","nan","1"
"DFE-2553","Corinne Richardson","SCS2","Director","Director of Data","Department for Education","Department for Education","Data Directorate","0370 000 2288","N/D","DFE-2536","534779","1.00","90000","N/A","","Other","East Midlands","nan","1"
"DFE-2554","N/D","SCS1","Deputy Director","Teachers' Pension Scheme Deputy Director","Department for Education","Department for Education","Teachers' Pension Scheme","0370 000 2288","N/D","DFE-2621","2246156","1.00","N/A","N/A","","Other","Yorkshire and The Humber","nan","1"
"DFE-2555","Alison Wilson","SCS2","Director","Regions Group: Yorkshire & Humber Director","Department for Education","Department for Education","Regions Group: Yorkshire & Humber","0370 000 2288","N/D","DFE-2302","181077","1.00","110000","N/A","","Other","North East","nan","1"
"DFE-2557","N/D","SCS1","Deputy Director","Advanced Analytics Deputy Director","Department for Education","Department for Education","Advanced Analytics Division","0370 000 2288","N/D","DFE-2534","1727737","1.00","N/A","N/A","","Other","West Midlands","nan","1"
"DFE-2558","N/D","SCS1","Deputy Director","CSC Social Worker Training, Development and Leadership Deputy Director","Department for Education","Department for Education","CSC Social Worker Training, Development and Leadership","0370 000 2288","N/D","DFE-2320","2449008","1.00","N/A","N/A","","Other","North West","nan","1"
"DFE-2559","N/D","SCS1","Deputy Director","Open Innovation Deputy Director","Department for Education","Department for Education","Open Innovation","0370 000 2288","N/D","DFE-2517","1020228","1.00","N/A","N/A","","Other","London","nan","1"
"DFE-2562","Andrew Thomas","SCS2","Director","Director of Corporate, Assurance and Restructuring","Department for Education","Department for Education","Funding and Financial Oversight","0370 000 2288","N/D","DFE-2536","574281","1.00","125000","N/A","","Other","Yorkshire and The Humber","nan","1"
"DFE-2563","N/D","SCS1","Deputy Director","Regions Group: East of England Deputy Director","Department for Education","Department for Education","Regions Group: East of England","0370 000 2288","N/D","DFE-2083","2180187","1.00","N/A","N/A","","Other","London","nan","1"
"DFE-2565","Michael Sunderland","SCS2","Director","Director of Operational Finance","Department for Education","Department for Education","Operational Finance","0370 000 2288","N/D","DFE-2536","460221","1.00","110000","N/A","","Other","London","nan","1"
"DFE-2566","Naomi Ramsay","SCS2","Director","Director of HR and Transformation","Department for Education","Department for Education","HR","0370 000 2288","N/D","DFE-2536","466013","1.00","110000","N/A","","Other","London","nan","1"
"DFE-2567","N/D","SCS1","Deputy Director","Schools and Funding Analysis Deputy Director","Department for Education","Department for Education","Schools and Funding Analysis","0370 000 2288","N/D","DFE-2312","3413428","1.00","N/A","N/A","","Other","Yorkshire and The Humber","nan","1"
"DFE-2568","Jane Balderstone","SCS2","Director","Capital Delivery Director","Department for Education","Department for Education","Capital Delivery","0370 000 2288","N/D","DFE-2536","1862998","1.00","110000","N/A","","Other","North West","nan","1"
"DFE-2570","N/D","SCS1","Deputy Director","Skills Strategy and Delivery Deputy Director","Department for Education","Department for Education","Skills Group","0370 000 2288","N/D","DFE-2367","0","1.00","N/A","N/A","","Other","London","nan","1"
"DFE-2571","N/D","SCS1","Deputy Director","SEND Strategy Deputy Director","Department for Education","Department for Education","SEND Strategy","0370 000 2288","N/D","DFE-2298","1766645","1.00","N/A","N/A","","Other","London","nan","1"
"DFE-2572","N/D","SCS1","Deputy Director","Regions Group: Yorkshire and the Humber Deputy Director","Department for Education","Department for Education","Regions Group: Yorkshire and the Humber","0370 000 2288","N/D","DFE-2555","2224453","0.80","N/A","N/A","","Other","Yorkshire and The Humber","nan","1"
"DFE-2577","Ian Coates","SCS2","Director","Regions Group: National Director","Department for Education","Department for Education","Regions Group: National","0370 000 2288","N/D","DFE-2302","1055614","0.66","70000","N/A","","Other","London","nan","1"
"DFE-2583","N/D","SCS1","Deputy Director","CS Policy Profession Unit Deputy Director","Department for Education","Department for Education","CS Policy Profession Unit","0370 000 2288","N/D","DFE-2517","1672811","1.00","N/A","N/A","","Other","London","nan","1"
"DFE-2596","N/D","SCS1","Deputy Director","Skills Strategy and Engagement Deputy Director","Department for Education","Department for Education","Skills Strategy and Engagement","0370 000 2288","N/D","DFE-2367","1249276","1.00","N/A","N/A","","Other","London","nan","1"
"DFE-2598","Jonathan Dewsbury","SCS2","Director","Director of Education Estates","Department for Education","Department for Education","Education Estates","0370 000 2288","N/D","DFE-2536","779460","1.00","110000","N/A","","Other","London","nan","1"
"DFE-2601","N/D","SCS1","Deputy Director","Enterprise Data for Funding and Oversight Deputy Director","Department for Education","Department for Education","Enterprise Data for Funding and Oversight","0370 000 2288","N/D","DFE-2553","3449744","1.00","N/A","N/A","","Other","West Midlands","nan","1"
"DFE-2603","N/D","SCS1","Deputy Director","Construction Delivery North East, Yorkshire Humber and East Midlands Deputy Director","Department for Education","Department for Education","Construction Delivery North East, Yorkshire Humber and East Midlands","0370 000 2288","N/D","DFE-2568","3205482","1.00","N/A","N/A","","Other","North East","nan","1"
"DFE-2604","N/D","SCS1","Deputy Director","Central Strategic Finance Deputy Director","Department for Education","Department for Education","Central Strategic Finance","0370 000 2288","N/D","DFE-2159","1052011","1.00","N/A","N/A","","Other","London","nan","1"
"DFE-2605","N/D","SCS1","Deputy Director","Higher Education Funding Integrity Deputy Director","Department for Education","Department for Education","Higher Education Funding Integrity","0370 000 2288","N/D","DFE-2307","573410","1.00","N/A","N/A","","Other","London","nan","1"
"DFE-2607","N/D","SCS1","Deputy Director","STA Assessment DDaT Deputy Director","Department for Education","Standard and Testing Agency","STA Assessment DDaT","0370 000 2288","N/D","DFE-2135","1151920","1.00","N/A","N/A","","Other","West Midlands","nan","1"
"DFE-2608","N/D","SCS1","Deputy Director","Major Projects and Risks Deputy Director","Department for Education","Department for Education","Major Projects and Risk","0370 000 2288","N/D","DFE-2497","1093030","1.00","N/A","N/A","","Other","North West","nan","1"
"DFE-2609","N/D","SCS1","Deputy Director","Funding Policy Implementation Deputy Director","Department for Education","Department for Education","Funding Policy Implementation","0370 000 2288","N/D","DFE-2562","2038080","1.00","N/A","N/A","","Other","London","nan","1"
"DFE-2610","N/D","SCS1","Deputy Director","Digital Delivery - Funding Services Deputy Director","Department for Education","Department for Education","Digital Delivery - Funding Services","0370 000 2288","N/D","DFE-2124","2001415","1.00","N/A","N/A","","Other","North West","nan","1"
"DFE-2611","N/D","SCS1","Deputy Director","Governance, Assurance and Partnerships Deputy Director","Department for Education","Department for Education","Governance, Assurance and Partnerships","0370 000 2288","N/D","DFE-2497","774108","1.00","N/A","N/A","","Other","North West","nan","1"
"DFE-2613","N/D","SCS1","Deputy Director","Regions Group: Yorkshire & Humber and National CSC and BSiL Deputy Director","Department for Education","Department for Education","Regions Group: Yorkshire & Humber and National CSC and BSiL","0370 000 2288","N/D","DFE-2555","715634","0.68","N/A","N/A","","Other","Yorkshire and The Humber","nan","1"
"DFE-2614","Lucy Livings","SCS2","Director","Regions Group: South West Director","Department for Education","Department for Education","Regions Group: South West","0370 000 2288","N/D","DFE-2302","164707","0.90","95000","N/A","","Other","South West","nan","1"
"DFE-2617","N/D","SCS1","Deputy Director","Deputy Director, Workforce Recruitment","Department for Education","Department for Education","Startegy Group","0370 000 2288","N/D","DFE-2098","0","1.00","N/A","N/A","","Other","London","nan","1"
"DFE-2618","N/D","SCS1","Deputy Director","Strategy Unit Deputy Director","Department for Education","Department for Education","Strategy Unit","0370 000 2288","N/D","DFE-2497","1048373","0.70","N/A","N/A","","Other","Yorkshire and The Humber","nan","1"
"DFE-2619","N/D","SCS1","Deputy Director","Work Based Skills Operational Delivery Deputy Director","Department for Education","Department for Education","Work Based Skills Operational Delivery","0370 000 2288","N/D","DFE-2129","2953423","1.00","N/A","N/A","","Other","London","nan","1"
"DFE-2620","N/D","SCS1","Deputy Director","Sector Skills Deputy Director","Department for Education","Department for Education","Skills Group","0370 000 2288","N/D","DFE-2367","0","1.00","N/A","N/A","","Other","London","nan","1"
